{
  "$schema": "../Common/PageSchema.json",
  "controls": [
    {
      "controlName": "Email",
      "controlType": "Textbox",
      "by": "Name",
      "value": "login"
    },
    {
      "controlName": "Password",
      "controlType": "Textbox",
      "by": "Name",
      "value": "password"
    },
    {
      "controlName": "Submit",
      "controlType": "Button",
      "by": "XPath",
      "value": "//*[@id='login_form']//button"
    }
  ],
  "pageName": "Admin Login Page",
  "title": "",
  "url": ""
}